{
  "documentVersion": 1,
  "generatedAt": "2026-09-18T10:00:42.250Z",
  "runtime": {
    "id": "fake",
    "version": "3.0.0-dev"
  },
  "providers": [
    {
      "provider": "openai-codex",
      "state": "logged-in",
      "subscription": true,
      "billing": "plan-limits",
      "source": "oauth",
      "accountLabel": "e***@example.com",
      "accountLabelNote": "masked",
      "checkedAt": "2026-09-18T10:00:42.250Z"
    },
    {
      "provider": "anthropic",
      "state": "absent",
      "subscription": false,
      "billing": "unknown",
      "caveat": "metered when enabled: triple opt-in required",
      "checkedAt": "2026-09-18T10:00:42.250Z"
    }
  ]
}
